,InvoiceNo,StockCode,Description,Quantity,InvoiceDate,UnitPrice,CustomerID,Country
5146,569468,23267,POPCORN HOLDER,-207,,214.78319,16445,United Kingdom
5147,580555,22526,SET OF 3 CAKE TINS PANTRY DESIGN ,145,,24.031548,15099,United Kingdom
5148,558777,21558,12 PENCILS TALL TUBE WOODLAND,-274,,-86.64688,13429,United Kingdom
5149,540255,23352,DRAWER KNOB VINTAGE GLASS BALL,-94,,33.121647,,United Kingdom
5150,578534,22699,BREAD BIN DINER STYLE IVORY,207,,-16.299723,16402,United Kingdom
5151,546096,22219,,436,,47.91852,16241,United Kingdom
5152,538524,22952,SET OF 3 HEART COOKIE CUTTERS,33,,3.3249753,15311,United Kingdom
5153,574728,21844,LUNCH BAG SPACEBOY DESIGN ,-298,,8.15162,,United Kingdom
5154,544906,21621,PACK OF 12 SUKI TISSUES ,102,,111.02996,,United Kingdom
5155,550890,72802B,DOG BOWL VINTAGE CREAM,-257,,51.81657,,United Kingdom
5156,578858,22356,PINK BUTTERFLY HANDBAG W BOBBLES,436,,-139.80457,16360,United Kingdom
5157,576617,22960,WOOD S/3 CABINET ANT WHITE FINISH,30,,-65.74605,15949,United Kingdom
5158,565437,72801d,WRAP DOILEY DESIGN,-85,,7.566939,12597,United Kingdom
5159,558774,21624,PINK/YELLOW FLOWERS HANDBAG,-103,,96.522194,,United Kingdom
5160,540664,22726,ALARM CLOCK BAKELIKE PINK,-162,,105.89904,,United Kingdom
5161,574310,84247E,PAPER POCKET TRAVELING FAN ,145,,35.658802,14096,United Kingdom
5162,551003,23344,JUMBO BAG DOILEY PATTERNS,100,,-84.9854,14713,United Kingdom
5163,566364,22413,PACK OF 12 TRADITIONAL CRAYONS,-54,,-54.14375,,United Kingdom
5164,577400,21989,FRENCH FLORAL CUSHION COVER ,-97,,53.771732,16657,United Kingdom
5165,576874,22624,REGENCY CAKESTAND 3 TIER,154,,-74.00045,12596,United Kingdom
5166,565541,22678,LAUNDRY 15C METAL SIGN,193,,-1.3736882,15494,United Kingdom
5167,556578,22629,WOODEN FRAME ANTIQUE WHITE ,221,,13.71125,16713,United Kingdom
5168,547253,23171,16 PIECE CUTLERY SET PANTRY DESIGN,152,,-9.65334,,United Kingdom
5169,569383,20619,PINK REGENCY TEACUP AND SAUCER,126,,28.91972,12720,United Kingdom
5170,540468,21738,CARD BILLBOARD FONT,-84,,81.8466,12567,United Kingdom
5171,539739,22914,ALARM CLOCK BAKELIKE RED ,230,,-44.294334,17850,United Kingdom
5172,552819,22714,CLOTHES PEGS RETROSPOT PACK 24 ,196,,139.94247,15443,United Kingdom
5173,553387,22629,LUNCH BAG RED RETROSPOT,446,,23.426023,12490,United Kingdom
5174,550953,22607,GREEN ENAMEL+GLASS HAIR COMB,-34,,54.610207,17589,United Kingdom
5175,537047,85099B,RETROSPOT HEART HOT WATER BOTTLE,-66,,-45.542686,17611,United Kingdom
5176,568909,22926,BLACK/BLUE POLKADOT UMBRELLA,-246,,-117.9479,14004,United Kingdom
5177,545514,22993,LUNCH BAG APPLE DESIGN,94,,28.366821,17284,United Kingdom
5178,581492,22620,OFFICE MUG WARMER CHOC+BLUE,-132,,-15.448354,16681,United Kingdom
5179,578846,22161,GLASS HEART T-LIGHT HOLDER ,278,,56.28595,12820,United Kingdom
5180,577938,22414,Manual,153,,-8.420388,13373,United Kingdom
5181,567742,84882,PAIR PADDED HANGERS PINK CHECK,140,,175.6853,,United Kingdom
5182,578852,22989,COFFEE MUG PEARS  DESIGN,-25,,-54.701626,13810,United Kingdom
5183,542624,20914,FLOWERS  STICKERS,-226,,31.368221,17841,United Kingdom
5184,575918,22515,ROSE DU SUD DRAWSTRING BAG,-122,,-190.35922,15088,United Kingdom
5185,551824,85169B,PACK OF 6 BIRDY GIFT TAGS,97,,25.739506,18139,United Kingdom
5186,546000,22114,JUMBO SHOPPER VINTAGE RED PAISLEY,564,,-11.708364,,United Kingdom
5187,581214,84380,PARTY INVITES JAZZ HEARTS,134,,47.578407,13322,United Kingdom
5188,568872,22563,PARTY METAL SIGN ,431,,86.51641,17337,United Kingdom
5189,544790,22574,"TRAY, BREAKFAST IN BED",-83,,21.470543,,United Kingdom
5190,568331,22737,HEART FILIGREE DOVE  SMALL,296,,-60.57533,15060,United Kingdom
5191,537666,84596B,PAPER LANTERN 9 POINT SNOW STAR,-10,,34.449432,,United Kingdom
5192,544970,21523,SKULL SHOULDER BAG,-187,,-31.64891,12915,United Kingdom
5193,563246,23254,TREE T-LIGHT HOLDER WILLIE WINKIE,-182,,-44.59494,15021,United Kingdom
5194,560039,21791,JUMBO BAG PINK VINTAGE PAISLEY,381,,-39.543236,16570,United Kingdom
5195,541506,22962,PLASTERS IN TIN CIRCUS PARADE ,120,,-42.993324,,United Kingdom
5196,549153,21389,WATERING CAN BLUE ELEPHANT,294,,36.41816,16379,United Kingdom
5197,543924,22352,WOOD 2 DRAWER CABINET WHITE FINISH,64,,-40.904526,14096,United Kingdom
5198,565542,20735,SILVER DIAMANTE PEN IN GIFT BOX,87,,120.74231,,United Kingdom
5199,540352,23078,WOODEN REGATTA BUNTING,-82,,48.896618,,United Kingdom
5200,571266,22909,SET OF 16 VINTAGE PISTACHIO CUTLERY,431,,-71.88349,12731,United Kingdom
5201,564754,23206,SPOTTY BUNTING,74,,13.6547575,14216,United Kingdom
5202,555647,23418,SET 36 COLOURING PENCILS DOILY,-166,,128.9076,15555,United Kingdom
5203,548308,21484,JAM JAR WITH PINK LID,-111,,-99.342354,13451,United Kingdom
5204,539437,21755,RED WOOLLY HOTTIE WHITE HEART.,37,,-28.129389,15601,United Kingdom
5205,577768,85099F,WOODEN HEART CHRISTMAS SCANDINAVIAN,102,,8.230321,18145,United Kingdom
5206,580364,22970,check,39,,27.44984,,United Kingdom
5207,548714,22412,PINK REGENCY TEACUP AND SAUCER,46,,-105.99283,,United Kingdom
5208,571945,22956,ANTIQUE SILVER TEA GLASS ENGRAVED,-38,,95.883995,14525,United Kingdom
5209,570677,48194,CERAMIC STRAWBERRY DESIGN MUG,-303,,-22.381977,12536,United Kingdom
5210,573695,22998,JUMBO BAG SCANDINAVIAN BLUE PAISLEY,-68,,-1.3026885,16618,United Kingdom
5211,565453,23209,PINK OVAL SHAPE TRINKET BOX,81,,19.073408,16942,United Kingdom
5212,563238,23466,SET 12 COLOUR PENCILS LOVE LONDON,-348,,-97.85827,13233,United Kingdom
5213,568670,21098,VICTORIAN SEWING BOX MEDIUM,-83,,16.445566,15708,United Kingdom
5214,581219,22024,PACK OF 12 WOODLAND TISSUES ,-20,,32.618317,17256,United Kingdom
5215,558480,23110,SET OF 3 REGENCY CAKE TINS,103,,-65.982605,14595,United Kingdom
5216,542709,22326,HOT WATER BOTTLE TEA AND SYMPATHY,331,,88.461136,,United Kingdom
5217,550199,22754,CHRISTMAS CRAFT WHITE FAIRY ,103,,-105.368034,,United Kingdom
5218,570413,21703,TEA COSY RED  STRIPE,295,,-4.535559,14547,United Kingdom
5219,548504,84991,LUNCH BAG RED RETROSPOT,0,,100.9492,,United Kingdom
5220,554019,82600,BAG 125g SWIRLY MARBLES,85,,2.5483282,15531,United Kingdom
5221,580127,22746,ASSORTED COLOURS SILK FAN,-358,,79.28189,17027,United Kingdom
5222,543000,22113,PHOTO FRAME 3 CLASSIC HANGING,218,,-55.568756,,United Kingdom
5223,577502,21427,LARGE YELLOW BABUSHKA NOTEBOOK ,43,,200.68967,14428,United Kingdom
5224,566290,22971,CHILDRENS CUTLERY POLKADOT PINK,-194,,-42.920254,16633,United Kingdom
5225,574074,22023,VINTAGE CREAM DOG FOOD CONTAINER,-86,,-35.44617,12717,United Kingdom
5226,547358,85204,SET OF 6 SPICE TINS PANTRY DESIGN,10,,19.644339,12867,United Kingdom
5227,580632,22900,CIRCUS PARADE LUNCH BOX ,-63,,47.875576,13450,United Kingdom
5228,555849,47590A,"SET 3 RETROSPOT TEA,COFFEE,SUGAR",21,,100.65797,,United Kingdom
5229,542709,20725,WOOD BLACK BOARD ANT WHITE FINISH,-302,,-134.29213,15009,United Kingdom
5230,576924,90018B,SET OF 6 HERB TINS SKETCHBOOK,-266,,25.657124,15811,United Kingdom
5231,567341,20963,SET OF 3 BUTTERFLY COOKIE CUTTERS,-254,,88.72902,16712,United Kingdom
5232,579196,21754,BOX OF 6 ASSORTED COLOUR TEASPOONS,-89,,35.82365,12904,United Kingdom
5233,574265,22193,CREAM HEART CARD HOLDER,236,,8.159575,13804,United Kingdom
5234,572846,22630,ROUND SNACK BOXES SET OF 4 FRUITS ,228,,-36.47695,13598,United Kingdom
5235,560417,22903,MARIE ANTOINETTE TRINKET BOX GOLD,-77,,-84.273674,13694,United Kingdom
5236,555400,22690,ENGLISH ROSE SCENTED HANGING FLOWER,41,,20.543268,,United Kingdom
5237,568703,22150,SCOTTIE DOG HOT WATER BOTTLE,66,,20.327066,12683,United Kingdom
5238,562031,23313,SET OF 12 FAIRY CAKE BAKING CASES,-389,,-14.059909,13263,United Kingdom
5239,570507,22076,SET/3 OCEAN SCENT CANDLE JEWEL BOX,74,,-13.335032,13102,United Kingdom
5240,570839,22561,POTTERING IN THE SHED METAL SIGN,-15,,-109.41716,17581,United Kingdom
5241,538208,22798,JAM MAKING SET PRINTED,170,,95.05256,17920,United Kingdom
5242,575972,20727,ROTATING LEAVES T-LIGHT HOLDER,-83,,10.255386,17078,United Kingdom
5243,563368,21260,SET 12 RETRO WHITE CHALK STICKS,-172,,-126.760895,14584,United Kingdom
5244,580075,21466,SET/3 OCEAN SCENT CANDLE JEWEL BOX,-103,,0.20379661,14096,United Kingdom
5245,561794,22695,SET OF 20 KIDS COOKIE CUTTERS,368,,65.9844,15287,United Kingdom
5246,566495,22423,LUNCH BAG  BLACK SKULL.,-78,,-95.95423,12621,United Kingdom
5247,541827,23296,CHARLOTTE BAG APPLES DESIGN,72,,83.30644,13040,United Kingdom
5248,574043,21028,SQUARECUSHION COVER PINK UNION JACK,228,,-68.6019,14426,United Kingdom
5249,C577383,21479,LUNCH BAG SPACEBOY DESIGN ,107,,195.49023,,United Kingdom
5250,570983,22755,6 EGG HOUSE PAINTED WOOD,-492,,-94.698105,15128,United Kingdom
5251,563557,21787,4 ROSE PINK DINNER CANDLES,59,,-36.031864,13521,United Kingdom
5252,C570274,22698,SET OF 5 PANCAKE DAY MAGNETS,-156,,-43.78756,,United Kingdom
5253,580884,90161C,PACK OF 12 STICKY BUNNIES,-124,,49.717213,17894,United Kingdom
5254,564825,23256,JUMBO BAG VINTAGE LEAF,-32,,109.324905,14640,United Kingdom
5255,537606,84378,60 CAKE CASES VINTAGE CHRISTMAS,-168,,-61.717793,,United Kingdom
5256,547964,22565,CHILDREN'S APRON DOLLY GIRL ,-78,,114.9914,16161,United Kingdom
5257,571441,22436,PINK POLKADOT BOWL,-58,,-1.0736938,12890,United Kingdom
5258,567671,22898,FINE WICKER HEART ,140,,-54.060516,12421,United Kingdom
5259,574476,22966,FLORAL FOLK STATIONERY SET,-37,,-94.827866,14004,United Kingdom
5260,575932,85169B,DOORMAT RED RETROSPOT,-159,,-72.23128,17797,United Kingdom
5261,545978,23032,ZINC T-LIGHT HOLDER STARS SMALL,279,,51.213207,16794,United Kingdom
5262,573362,23224,LAUREL HEART ANTIQUE SILVER,-173,,86.528595,17920,United Kingdom
5263,570688,22176,ZINC WILLIE WINKIE  CANDLE STICK,-54,,6.5356035,17105,United Kingdom
5264,559986,21535,CHRISTMAS MUSICAL ZINC TREE,21,,96.41014,15766,United Kingdom
5265,564754,22659,ALARM CLOCK BAKELIKE RED ,-303,,85.87217,17964,United Kingdom
5266,561214,22557,SET 6 FOOTBALL CELEBRATION CANDLES,302,,114.42526,14383,United Kingdom
5267,559052,22279,MONSTERS STENCIL CRAFT,99,,-41.75949,16504,United Kingdom
5268,564184,22436,TRAVEL CARD WALLET SKULLS,-366,,-60.633167,12536,United Kingdom
5269,553074,22495,FRENCH ENAMEL POT W LID,226,,-82.35983,15436,United Kingdom
5270,560240,22291,GLASS BON BON JAR,210,,-143.94484,14790,United Kingdom
5271,551715,22187,GREEN POLKADOT PLATE ,133,,41.92879,17059,United Kingdom
5272,568392,22101,RED RETROSPOT SMALL MILK JUG,-93,,-59.031586,15531,United Kingdom
5273,581439,23301,LUNCH BAG VINTAGE LEAF DESIGN,129,,-72.724266,16936,United Kingdom
5274,559317,84879,DOORMAT NEW ENGLAND,-156,,59.579247,14388,United Kingdom
5275,569372,23494,HEART MINI PORTRAIT FRAME,-9,,-28.231619,12545,United Kingdom
5276,C566263,48194,IVORY GIANT GARDEN THERMOMETER,4,,154.60077,15916,United Kingdom
5277,575698,22085,CREAM SWEETHEART MINI CHEST,240,,-107.58687,14893,United Kingdom
5278,540646,22128,DOORMAT FAIRY CAKE,51,,29.190655,17509,United Kingdom
5279,564372,21165,CHILDRENS TOY COOKING UTENSIL SET,34,,-65.50602,12528,United Kingdom
5280,564760,23306,LUNCH BAG ALPHABET DESIGN,-149,,40.298508,18077,United Kingdom
5281,575369,21327,FELTCRAFT PRINCESS LOLA DOLL,154,,-97.56968,,United Kingdom
5282,550986,22595,BATHROOM METAL SIGN,-50,,19.598501,16518,United Kingdom
5283,547094,22112,ROTATING LEAVES T-LIGHT HOLDER,133,,-102.4947,17757,United Kingdom
5284,538201,21071,60 TEATIME FAIRY CAKE CASES,121,,-18.55936,,United Kingdom
5285,565452,82580,GIN AND TONIC MUG,16,,-94.62956,17423,United Kingdom
5286,547822,21314,PACK OF 12 PINK PAISLEY TISSUES ,-26,,-3.7862947,15907,United Kingdom
5287,540546,21212,NATURAL SLATE HEART CHALKBOARD ,11,,83.498055,18102,United Kingdom
5288,570208,20724,ENGLISH ROSE NOTEBOOK A7 SIZE,191,,-151.22768,,United Kingdom
5289,559816,22957,MAGIC DRAWING SLATE BUNNIES ,181,,-11.210128,13467,United Kingdom
5290,542541,20979,GENTLEMAN SHIRT REPAIR KIT ,-120,,-9.131888,,United Kingdom
5291,538071,21470,HANGING CHICK  YELLOW DECORATION,-65,,-65.80299,,United Kingdom
5292,572073,22508,GREEN REGENCY TEACUP AND SAUCER,-295,,-98.05578,12971,United Kingdom
5293,558085,21933,CHILDRENS APRON APPLES DESIGN,152,,-83.7238,14904,United Kingdom
5294,577511,23343,SPACEBOY CHILDRENS BOWL,124,,17.155235,,United Kingdom
5295,580256,22840,HAPPY STENCIL CRAFT,169,,-14.691217,14911,United Kingdom
5296,573415,22674,BLUE CALCULATOR RULER,-13,,75.659096,12433,United Kingdom
5297,571745,84030E,JUMBO BAG RED RETROSPOT,550,,-16.363003,18178,United Kingdom
5298,556045,22784,DOORMAT RED RETROSPOT,57,,119.87749,,United Kingdom
5299,C580312,22084,RED SPOTTY BISCUIT TIN,423,,116.15597,13310,United Kingdom
5300,549574,22717,ENCHANTED BIRD COATHANGER 5 HOOK,99,,-56.557743,,United Kingdom
5301,553035,22984,SET/20 STRAWBERRY PAPER NAPKINS ,119,,-86.83272,14784,United Kingdom
5302,579196,22074,BLACK HEART CARD HOLDER,68,,32.50715,13117,United Kingdom
5303,541115,21174,DOORMAT WELCOME TO OUR HOME,-49,,-107.65014,13408,United Kingdom
5304,542213,84251B,SKULLS GREETING CARD,-307,,18.827557,15555,United Kingdom
5305,550297,84879,KNITTED UNION FLAG HOT WATER BOTTLE,96,,38.811443,15829,United Kingdom
5306,570871,21908,WHITE TALL PORCELAIN T-LIGHT HOLDER,-144,,20.034538,13004,United Kingdom
5307,537153,22367,METAL MERRY CHRISTMAS WREATH,122,,21.647295,15704,United Kingdom
5308,544754,22191,HAND WARMER OWL DESIGN,392,,15.379728,13089,United Kingdom
5309,538071,22338,JUMBO BAG RED RETROSPOT,76,,18.797579,12517,United Kingdom
5310,561220,22535,GLITTER HEART DECORATION,112,,-66.56723,17038,United Kingdom
5311,556790,84032B,PINK UNION JACK  LUGGAGE TAG,46,,98.45076,13558,United Kingdom
5312,565841,22928,CARD PARTY GAMES ,-387,,62.342163,,United Kingdom
5313,538204,23080,TEATIME ROUND PENCIL SHARPENER ,-177,,107.90915,,United Kingdom
5314,578541,85039B,FOOD COVER WITH BEADS SET 2 ,54,,41.53438,16745,United Kingdom
5315,571679,22468,LUNCH BAG  BLACK SKULL.,26,,-104.09379,13851,United Kingdom
5316,536783,23227,TRAVEL CARD WALLET TRANSPORT,-162,,-29.410137,,United Kingdom
5317,552341,23007,DOLLY GIRL BABY GIFT SET,47,,81.854836,17625,United Kingdom
5318,567656,23335,sold as set on dotcom,253,,0.6781651,17243,United Kingdom
5319,570871,20662,PAPER BUNTING COLOURED LACE,60,,170.45898,14701,United Kingdom
5320,545340,22547,SET OF 36 PAISLEY FLOWER DOILIES,181,,-33.571518,15067,United Kingdom
5321,560368,21466,CREAM SLICE FLANNEL PINK SPOT ,-130,,-17.09176,13081,United Kingdom
5322,564760,22962,BLACK PIRATE TREASURE CHEST,-191,,-7.488331,,United Kingdom
5323,547362,22730,PACK OF 12 BLUE PAISLEY TISSUES ,44,,102.367676,18093,United Kingdom
5324,567024,16161U,LUNCH BAG SUKI DESIGN ,5,,-18.72449,13931,United Kingdom
5325,580640,22754,T-LIGHT HOLDER HANGING LACE,104,,6.4430895,14390,United Kingdom
5326,571905,22617,COFFEE MUG PINK PAISLEY DESIGN,-248,,80.32597,14096,United Kingdom
5327,544087,23052,FELT EGG COSY LADYBIRD ,285,,-61.856857,14646,United Kingdom
5328,547549,84828,PARTY BUNTING,199,,-32.852154,15311,United Kingdom
5329,546988,21043,TRAVEL CARD WALLET I LOVE LONDON,-105,,-0.10895246,15516,United Kingdom
5330,561369,21033,JUMBO  BAG BAROQUE BLACK WHITE,72,,-55.707397,16813,United Kingdom
5331,566283,23108,SILVER BELLS TABLE DECORATION,-112,,104.40548,17813,United Kingdom
5332,555276,22551,VICTORIAN SEWING BOX MEDIUM,-52,,-98.36201,,United Kingdom
5333,568674,84596F,DOLLY MIXTURE CHILDREN'S UMBRELLA,235,,62.641644,17576,United Kingdom
5334,540477,84988,HEART DECORATION WITH PEARLS ,445,,75.260376,17050,United Kingdom
5335,571082,84032A,BAKING SET SPACEBOY DESIGN,-69,,-33.780563,13209,United Kingdom
5336,536755,21918,PAPER BUNTING WHITE LACE,281,,-71.81374,14963,United Kingdom
5337,553522,22785,DOORMAT FANCY FONT HOME SWEET HOME,151,,142.3426,,United Kingdom
5338,546549,21327,PACK OF 12 WOODLAND TISSUES ,31,,30.265514,15212,United Kingdom
5339,579167,79321,JUMBO BAG OWLS,145,,-129.17442,14618,United Kingdom
5340,539492,21172,RED RETROSPOT SHOPPER BAG,-32,,-80.443825,,United Kingdom
5341,543973,22156,DOORMAT RED RETROSPOT,-82,,-10.301436,17858,United Kingdom
5342,541011,20724,Manual,-125,,89.72578,17400,United Kingdom
5343,569097,20712,HANGING JAM JAR T-LIGHT HOLDER,310,,-102.06598,12347,United Kingdom
5344,581175,23163,SET OF 2 CERAMIC PAINTED HEARTS ,188,,-65.608025,13566,United Kingdom
5345,570761,22219,RETROSPOT PARTY BAG + STICKER SET,199,,159.50372,13137,United Kingdom
5346,560922,84796a,TOILET SIGN OCCUPIED OR VACANT,104,,99.323105,12662,United Kingdom
5347,537086,21479,CLOTHES PEGS RETROSPOT PACK 24 ,14,,-55.331104,14096,United Kingdom
5348,569229,22585,METAL SIGN CUPCAKE SINGLE HOOK,-123,,58.853153,16919,United Kingdom
5349,554704,84946,TOAST ITS - FAIRY FLOWER,39,,28.150648,13341,United Kingdom
5350,549279,22835,FAMILY PHOTO FRAME CORNICE,281,,-77.26992,14713,United Kingdom
5351,542109,21933,RED PUDDING SPOON,-373,,-41.967236,,United Kingdom
5352,557937,23176,PANTRY ROLLING PIN,532,,95.889824,14852,United Kingdom
5353,565366,22297,12 MESSAGE CARDS WITH ENVELOPES,-323,,13.133068,15274,United Kingdom
5354,556812,22962,ANTIQUE GLASS DRESSING TABLE POT,-56,,-12.611159,,United Kingdom
5355,580154,21587,KITCHEN METAL SIGN,-144,,4.297387,,United Kingdom
5356,568188,22774,HOMEMADE JAM SCENTED CANDLES,-220,,-93.65687,,United Kingdom
5357,551055,21533,JUMBO BAG PINK VINTAGE PAISLEY,-257,,32.971447,,United Kingdom
5358,563216,48194,SET OF 3 HEART COOKIE CUTTERS,-74,,104.78287,14688,United Kingdom
5359,542276,22571,CARD MOTORBIKE SANTA,53,,-108.89826,,United Kingdom
5360,580367,23355, TRELLIS COAT RACK,-73,,11.750872,13282,United Kingdom
5361,565840,47504K,SET OF 3 CAKE TINS SKETCHBOOK,16,,-10.80236,17609,United Kingdom
5362,568912,21625,PINK SWEETHEART BRACELET,139,,2.795273,,United Kingdom
5363,543097,15039,JUMBO BAG ALPHABET,81,,-67.150116,16265,United Kingdom
5364,556960,22144,PLASTERS IN TIN STRONGMAN,-604,,-28.127754,16869,United Kingdom
5365,544159,22079,EDWARDIAN PARASOL PINK,-23,,53.478577,18272,United Kingdom
5366,543806,22367,RETROSPOT RED WASHING UP GLOVES,103,,91.52495,,United Kingdom
5367,551554,84970L,CLOTHES PEGS RETROSPOT PACK 24 ,0,,-102.28304,,United Kingdom
5368,564381,85159B,VINTAGE EMBOSSED HEART,146,,-37.13024,16172,United Kingdom
5369,554069,22197,HOT WATER BOTTLE TEA AND SYMPATHY,11,,11.9091,17841,United Kingdom
5370,563584,22662,CLEAR DRAWER KNOB ACRYLIC EDWARDIAN,223,,130.22464,15719,United Kingdom
5371,581147,21428,HANGING CHICK GREEN DECORATION,211,,-80.48412,17783,United Kingdom
5372,569220,20974,HOT WATER BOTTLE BABUSHKA ,-412,,50.56486,,United Kingdom
5373,570818,22364,S/6 WOODEN SKITTLES IN COTTON BAG,95,,100.38075,14088,United Kingdom
5374,557217,22382,SKULLS  WATER TRANSFER TATTOOS ,-1,,53.485348,,United Kingdom
5375,563371,71477,BROWN KUKUI COCONUT SEED NECKLACE,-257,,56.9978,,United Kingdom
5376,541422,84279P,FELTCRAFT 6 FLOWER FRIENDS,-379,,0.36208522,17870,United Kingdom
5377,574063,22025,SMALL FOLKART STAR CHRISTMAS DEC,32,,17.050589,14156,United Kingdom
5378,556631,84912B,COWBOYS AND INDIANS BIRTHDAY CARD ,53,,100.369644,17282,United Kingdom
5379,558777,22144,AIRLINE BAG VINTAGE JET SET WHITE,324,,-38.87857,,United Kingdom
5380,572856,22602,WOODEN CROQUET GARDEN SET,28,,38.100998,17379,United Kingdom
5381,580632,23355,SET 36 COLOUR PENCILS DOLLY GIRL,-223,,-45.94126,15694,United Kingdom
5382,560244,23319,HANGING MINI COLOURED BOTTLES,120,,24.224352,,United Kingdom
5383,537204,21992,METAL 4 HOOK HANGER FRENCH CHATEAU,-123,,51.938385,,United Kingdom
5384,551419,21980,HAND WARMER BIRD DESIGN,-47,,-7.0365024,16293,United Kingdom
5385,537201,90214C,BREAD BIN DINER STYLE IVORY,-105,,15.728187,15296,United Kingdom
5386,558637,22969,HAND WARMER OWL DESIGN,-169,,72.901184,14395,United Kingdom
5387,569896,85099C,JUMBO BAG PINK POLKADOT,-298,,136.77727,,United Kingdom
5388,567880,20751,SET OF 4 POLKADOT PLACEMATS ,-416,,68.20308,16979,United Kingdom
5389,541417,22595,METAL SIGN TAKE IT OR LEAVE IT ,226,,146.00645,,United Kingdom
5390,543277,22574,PINK POLKADOT BOWL,78,,-68.47651,14307,United Kingdom
5391,575930,22904,MAGNETS PACK OF 4 HOME SWEET HOME,155,,-67.88518,14049,United Kingdom
5392,546108,22775,RIBBON REEL CHRISTMAS SOCK BAUBLE,350,,-79.14452,,United Kingdom
5393,551468,22993,CREAM FELT EASTER EGG BASKET,-32,,116.01885,,United Kingdom
5394,551547,22155,CABIN BAG VINTAGE PAISLEY,-139,,-42.70175,14680,United Kingdom
5395,575875,82583,HEART DECORATION RUSTIC HANGING ,-277,,-18.45727,15453,United Kingdom
5396,570209,21231,ROSES REGENCY TEACUP AND SAUCER ,-319,,160.84183,16249,United Kingdom
5397,561128,15058C,CHILDRENS CUTLERY RETROSPOT RED ,161,,155.5721,14730,United Kingdom
5398,579094,22834,SET 20 NAPKINS FAIRY CAKES DESIGN ,-236,,-48.18495,14735,United Kingdom
5399,573572,22079,WRAP CHRISTMAS VILLAGE,162,,97.889656,14696,United Kingdom
5400,580744,23283,TOILET SIGN OCCUPIED OR VACANT,-133,,75.57237,16369,United Kingdom
5401,571713,22804,CHRISTMAS CRAFT LITTLE FRIENDS,-163,,40.394787,12436,United Kingdom
5402,553369,23212,LUNCH BAG APPLE DESIGN,70,,36.29303,17841,United Kingdom
5403,557007,84947,PAPER BUNTING WHITE LACE,261,,36.360573,12916,United Kingdom
5404,576617,23209,JUMBO BAG APPLES,-202,,-55.466236,16362,United Kingdom
5405,580717,23570,LUNCH BAG RED VINTAGE DOILY,251,,-117.69034,13521,United Kingdom
5406,573585,22043,RETRO MOD TRAY,78,,93.0721,12950,United Kingdom
5407,576837,22072,FRENCH TOILET SIGN BLUE METAL,-53,,-24.986921,15471,United Kingdom
5408,578065,23626,PINK HANGING HEART T-LIGHT HOLDER,-334,,136.63808,15010,United Kingdom
5409,552667,85136C,LAUNDRY 15C METAL SIGN,142,,55.95381,15311,United Kingdom
5410,576897,22059,RED RETROSPOT MINI CASES,45,,61.74764,15998,United Kingdom
5411,544461,84870B,GUMBALL MAGAZINE RACK,26,,-75.54145,17841,United Kingdom
5412,574351,23203,BISCUIT TIN VINTAGE CHRISTMAS,210,,-38.659943,14944,United Kingdom
5413,578067,23322,SPOTTY BUNTING,-177,,44.94135,15511,United Kingdom
5414,561862,22653,FELTCRAFT 6 FLOWER FRIENDS,-196,,18.108475,16115,United Kingdom
5415,572279,84249A,SPACEBOY BIRTHDAY CARD,-124,,-126.586395,14546,United Kingdom
5416,559330,22616,60 CAKE CASES VINTAGE CHRISTMAS,-72,,-24.006107,17001,United Kingdom
5417,554643,22848,GIRLS VINTAGE TIN SEASIDE BUCKET,-190,,220.94408,16343,United Kingdom
5418,566171,23252,LAUREL STAR ANTIQUE GOLD,-86,,-43.90443,,United Kingdom
5419,564835,20803,PING! MICROWAVE PLATE,105,,80.20869,16855,United Kingdom
5420,574714,22789,"KEY FOB , FRONT  DOOR ",50,,-51.835896,14096,United Kingdom
5421,551471,22337,WHITE BELL HONEYCOMB PAPER GARLAND ,-250,,72.18515,14009,United Kingdom
5422,536988,22505,SCOTTIE DOGS BABY BIB,-163,,-51.064827,,United Kingdom
5423,555650,20669,HERB MARKER CHIVES ,-321,,-60.517723,13266,United Kingdom
5424,568668,20712,METAL 4 HOOK HANGER FRENCH CHATEAU,-60,,-60.979,16015,United Kingdom
5425,569487,22820,BAROQUE BUTTERFLY EARRINGS PINK,57,,-14.667329,16919,United Kingdom
5426,578999,21802,FOUR HOOK  WHITE LOVEBIRDS,147,,-121.96896,,United Kingdom
5427,556812,20727,TRAVEL SEWING KIT,168,,90.05428,17426,United Kingdom
5428,539455,22728,BLUE COAT RACK PARIS FASHION,12,,6.5843453,15513,United Kingdom
5429,575330,84978,ECONOMY LUGGAGE TAG,145,,18.699045,,United Kingdom
5430,570807,20677,TRADITIONAL KNITTING NANCY,133,,99.744774,,United Kingdom
5431,542600,22138,BLUE & WHITE BREAKFAST TRAY,-25,,-143.8727,12841,United Kingdom
5432,556905,82567,RECYCLING BAG RETROSPOT ,113,,59.409554,12856,United Kingdom
5433,562612,15058A,SET OF 36 MUSHROOM PAPER DOILIES,30,,15.626569,,United Kingdom
5434,568650,22677,CHILDS GARDEN FORK BLUE ,-125,,-78.032745,13078,United Kingdom
5435,559506,21539,HEART BEADED TRELLIS DECORATION,176,,-212.12148,15296,United Kingdom
5436,545630,23211,HEART WREATH DECORATION WITH BELL,-327,,40.490562,16242,United Kingdom
5437,537769,22352,DOORMAT FANCY FONT HOME SWEET HOME,-35,,-36.766903,,United Kingdom
5438,574740,23103,LUNCH BAG VINTAGE LEAF DESIGN,35,,-152.09071,18005,United Kingdom
5439,554714,23318,PLAYING CARDS KEEP CALM & CARRY ON,-340,,-38.661934,14159,United Kingdom
5440,563549,22553,PACK OF 6 BIRDY GIFT TAGS,50,,69.04661,14868,United Kingdom
5441,556201,21154,CARD DOLLY GIRL ,416,,-76.01346,13314,United Kingdom
5442,576078,22436,BUTTERFLIES STICKERS,-315,,-25.366976,,United Kingdom
5443,550542,22627,SET OF 2 WOODEN MARKET CRATES,157,,-44.86632,17282,United Kingdom
5444,558876,22663,FOLDING UMBRELLA CREAM POLKADOT,-197,,129.83974,15861,United Kingdom
5445,562264,21544,FELTCRAFT CHRISTMAS FAIRY,143,,216.8651,16771,United Kingdom
5446,567462,D,CLASSIC METAL BIRDCAGE PLANT HOLDER,184,,98.39352,12748,United Kingdom
5447,549182,85049E,SET OF 3 HEART COOKIE CUTTERS,-7,,132.58435,17841,United Kingdom
5448,538171,22741,CHRISTMAS PUDDING TRINKET POT ,-131,,-36.711407,,United Kingdom
5449,563076,21658,GROW YOUR OWN PLANT IN A CAN ,-165,,-162.13005,,United Kingdom
5450,552285,22753,EMPIRE TISSUE BOX,-174,,41.565742,12578,United Kingdom
5451,C574515,22961,WOODEN FRAME ANTIQUE WHITE ,-165,,16.984402,14998,United Kingdom
5452,572662,22461,TRAVEL CARD WALLET VINTAGE TICKET,310,,-45.919724,16261,United Kingdom
5453,569718,22813,WASHROOM METAL SIGN,185,,111.16728,16261,United Kingdom
5454,575167,22993,SILVER LARIAT 40CM,-243,,-69.81694,14978,United Kingdom
5455,574479,22586,15CM CHRISTMAS GLASS BALL 20 LIGHTS,-330,,-2.9047532,17288,United Kingdom
5456,556671,22251,ASS FLORAL PRINT SPIRIT LEVEL ,498,,51.33144,17189,United Kingdom
5457,576618,84581,BLUE POLKADOT BOWL,-151,,182.25612,14410,United Kingdom
5458,574657,23040,ZINC SWEETHEART SOAP DISH,24,,-53.84175,14711,United Kingdom
5459,575177,82567,HEART OF WICKER SMALL,-357,,-55.46884,18274,United Kingdom
5460,556072,22834,HOLIDAY FUN LUDO,43,,-107.68398,15750,United Kingdom
5461,555278,23570,LUNCH BAG RED VINTAGE DOILY,120,,-18.420334,17873,United Kingdom
5462,546892,15056N,JUMBO STORAGE BAG SUKI,111,,131.16255,,United Kingdom
5463,565150,23541,HOME SWEET HOME 2 DRAWER CABINET,-141,,-0.23257841,14462,United Kingdom
5464,578817,23203,IVORY CAFE HANGING LAMP ,254,,-125.24106,15947,United Kingdom
5465,574237,22107,SET/12 TAPER CANDLES,-13,,166.8066,16574,United Kingdom
5466,577609,22423,RED RETROSPOT TAPE,409,,113.98698,,United Kingdom
